{
  "schema_version": "1.0.0",
  "trace_id": "trace-e2-a11-sample",
  "job_type": "REPAIR",
  "idempotency_key": "e2-repair-c1",
  "input": {
    "repository": {
      "url": "https://github.com/example/make-sample.git",
      "commit": "fedcba9876543210fedcba9876543210fedcba98"
    },
    "md_report_uri": "artifact://job-FULL_CHECK-001/report-001/error-report.json",
    "makefile_path": "Makefile",
    "environment": {
      "image_uri": "artifact://job-DRAFT-001/image-001/image.tar",
      "configuration_id": "cfg-ubuntu22-gcc12-release-v1"
    },
    "build_command": "make",
    "verify_command": "make test",
    "timeout_seconds": 1800
  }
}
